id,feature_class,feature_code,name,description
584,T,RKFL,rockfall,an irregular mass of fallen rock at the base of a cliff or steep slope
585,T,RKS,rocks,"conspicuous, isolated rocky masses"
586,T,SAND,sand area,a tract of land covered with sand
587,T,SBED,dry stream bed,a channel formerly containing the water of a stream
588,T,SCRP,escarpment,a long line of cliffs or steep slopes separating level surfaces above and below
589,T,SDL,saddle,"a broad, open pass crossing a ridge or between hills or mountains"
590,T,SHOR,shore,"a narrow zone bordering a waterbody which covers and uncovers at high and low water, respectively"
591,T,SINK,sinkhole,a small crater-shape depression in a karst area
592,T,SLID,slide,"a mound of earth material, at the base of a slope and the associated scoured area"
593,T,SLP,slope(s),a surface with a relatively uniform slope angle
594,T,SPIT,spit,"a narrow, straight or curved continuation of a beach into a waterbody"
595,T,SPUR,spur(s),"a subordinate ridge projecting outward from a hill, mountain or other elevation"
596,T,TAL,talus slope,a steep concave slope formed by an accumulation of loose rock fragments at the base of a cliff or steep slope
597,T,TRGD,interdune trough(s),a long wind-swept trough between parallel longitudinal dunes
598,T,TRR,terrace,"a long, narrow alluvial platform bounded by steeper slopes above and below, usually overlooking a waterbody"
599,T,UPLD,upland,an extensive interior region of high land with low to moderate surface relief
600,T,VAL,valley,an elongated depression usually traversed by a stream
601,T,VALG,hanging valley,a valley the floor of which is notably higher than the valley or shore to which it leads; most common in areas that have been glaciated
602,T,VALS,valleys,elongated depressions usually traversed by a stream
603,T,VALX,section of valley,
604,T,VLC,volcano,a conical elevation composed of volcanic materials with a crater at the top
605,U,APNU,apron,"a gentle slope, with a generally smooth surface, particularly found around groups of islands and seamounts"
606,U,ARCU,arch,a low bulge around the southeastern end of the island of Hawaii
607,U,ARRU,arrugado,an area of subdued corrugations off Baja California
608,U,BDLU,borderland,"a region adjacent to a continent, normally occupied by or bordering a shelf, that is highly irregular with depths well in excess of those typical of a shelf"
609,U,BKSU,banks,"elevations, typically located on a shelf, over which the depth of water is relatively shallow but sufficient for safe surface navigation"
610,U,BNKU,bank,"an elevation, typically located on a shelf, over which the depth of water is relatively shallow but sufficient for safe surface navigation"
611,U,BSNU,basin,a depression more or less equidimensional in plan and of variable extent
612,U,CDAU,cordillera,"an entire mountain system including the subordinate ranges, interior plateaus, and basins"
613,U,CNSU,canyons,"relatively narrow, deep depressions with steep sides, the bottom of which generally has a continuous slope"
614,U,CNYU,canyon,"a relatively narrow, deep depression with steep sides, the bottom of which generally has a continuous slope"
615,U,CRSU,continental rise,a gentle slope rising from oceanic depths towards the foot of a continental slope
616,U,DEPU,deep,"a localized deep area within the confines of a larger feature, such as a trough, basin or trench"
617,U,EDGU,shelf edge,a line along which there is a marked increase of slope at the outer margin of a continental shelf or island shelf
618,U,ESCU,escarpment (or scarp),an elongated and comparatively steep slope separating flat or gently sloping areas
619,U,FANU,fan,a relatively smooth feature normally sloping away from the lower termination of a canyon or canyon system
620,U,FLTU,flat,a small level or nearly level area
621,U,FRZU,fracture zone,"an extensive linear zone of irregular topography of the sea floor, characterized by steep-sided or asymmetrical ridges, troughs, or escarpments"
622,U,FURU,furrow,"a closed, linear, narrow, shallow depression"
623,U,GAPU,gap,a narrow break in a ridge or rise
624,U,GLYU,gully,a small valley-like feature
625,U,HLLU,hill,an elevation rising generally less than 500 meters
626,U,HLSU,hills,elevations rising generally less than 500 meters
627,U,HOLU,hole,a small depression of the sea floor
628,U,KNLU,knoll,"an elevation rising generally more than 500 meters and less than 1,000 meters and of limited extent across the summit"
629,U,KNSU,knolls,"elevations rising generally more than 500 meters and less than 1,000 meters and of limited extent across the summits"
630,U,LDGU,ledge,"a rocky projection or outcrop, commonly linear and near shore"
631,U,LEVU,levee,"an embankment bordering a canyon, valley, or seachannel"
632,U,MESU,mesa,"an isolated, extensive, flat-topped elevation on the shelf, with relatively steep sides"
633,U,MNDU,mound,"a low, isolated, rounded hill"
634,U,MOTU,moat,"an annular depression that may not be continuous, located at the base of many seamounts, islands, and other isolated elevations"
635,U,MTU,mountain,a well-delineated subdivision of a large and complex positive feature
636,U,PKSU,peaks,"prominent elevations, part of a larger feature, either pointed or of very limited extent across the summit"
637,U,PKU,peak,"a prominent elevation, part of a larger feature, either pointed or of very limited extent across the summit"
638,U,PLNU,plain,"a flat, gently sloping or nearly level region"
639,U,PLTU,plateau,"a comparatively flat-topped feature of considerable extent, dropping off abruptly on one or more sides"
640,U,PNLU,pinnacle,"a high tower or spire-shaped pillar of rock or coral, alone or cresting a summit"
641,U,PRVU,province,a region identifiable by a group of similar physiographic features whose characteristics are markedly in contrast with surrounding areas
642,U,RDGU,ridge,a long narrow elevation with steep sides
643,U,RDSU,ridges,long narrow elevations with steep sides
644,U,RFSU,reefs,surface-navigation hazards composed of consolidated material
645,U,RFU,reef,a surface-navigation hazard composed of consolidated material
646,U,RISU,rise,"a broad elevation that rises gently, and generally smoothly, from the sea floor"
647,U,SCNU,seachannel,"a continuously sloping, elongated depression commonly found in fans or plains and customarily bordered by levees on one or two sides"
648,U,SCSU,seachannels,"continuously sloping, elongated depressions commonly found in fans or plains and customarily bordered by levees on one or two sides"
649,U,SDLU,saddle,"a low part, resembling in shape a saddle, in a ridge or between contiguous seamounts"
650,U,SHFU,shelf,a zone adjacent to a continent (or around an island) that extends from the low water line to a depth at which there is usually a marked increase of slope towards oceanic depths
651,U,SHLU,shoal,a surface-navigation hazard composed of unconsolidated material
652,U,SHSU,shoals,hazards to surface navigation composed of unconsolidated material
653,U,SHVU,shelf valley,"a valley on the shelf, generally the shoreward extension of a canyon"
654,U,SILU,sill,the low part of a gap or saddle separating basins
655,U,SLPU,slope,the slope seaward from the shelf edge to the beginning of a continental rise or the point where there is a general reduction in slope
656,U,SMSU,seamounts,"elevations rising generally more than 1,000 meters and of limited extent across the summit"
657,U,SMU,seamount,"an elevation rising generally more than 1,000 meters and of limited extent across the summit"
658,U,SPRU,spur,"a subordinate elevation, ridge, or rise projecting outward from a larger feature"
659,U,TERU,terrace,"a relatively flat horizontal or gently inclined surface, sometimes long and narrow, which is bounded by a steeper ascending slope on one side and by a steep descending slope on the opposite side"
660,U,TMSU,tablemounts (or guyots),"seamounts having a comparatively smooth, flat top"
661,U,TMTU,tablemount (or guyot),"a seamount having a comparatively smooth, flat top"
662,U,TNGU,tongue,an elongate (tongue-like) extension of a flat sea floor into an adjacent higher feature
663,U,TRGU,trough,"a long depression of the sea floor characteristically flat bottomed and steep sided, and normally shallower than a trench"
664,U,TRNU,trench,"a long, narrow, characteristically very deep and asymmetrical depression of the sea floor, with relatively steep sides"
665,U,VALU,valley,"a relatively shallow, wide depression, the bottom of which usually has a continuous gradient"
666,U,VLSU,valleys,"a relatively shallow, wide depression, the bottom of which usually has a continuous gradient"
667,V,BUSH,bush(es),a small clump of conspicuous bushes in an otherwise bare area
668,V,CULT,cultivated area,an area under cultivation
669,V,FRST,forest(s),an area dominated by tree vegetation
670,V,FRSTF,fossilized forest,a forest fossilized by geologic processes and now exposed at the earth's surface
671,V,GROVE,grove,"a small wooded area or collection of trees growing closely together, occurring naturally or deliberately planted"
672,V,GRSLD,grassland,an area dominated by grass vegetation
673,V,GRVC,coconut grove,a planting of coconut trees
674,V,GRVO,olive grove,a planting of olive trees
675,V,GRVP,palm grove,a planting of palm trees
676,V,GRVPN,pine grove,a planting of pine trees
677,V,HTH,heath,an upland moor or sandy area dominated by low shrubby vegetation including heather
678,V,MDW,meadow,"a small, poorly drained area dominated by grassy vegetation"
679,V,OCH,orchard(s),a planting of fruit or nut trees
680,V,SCRB,scrubland,"an area of low trees, bushes, and shrubs stunted by some environmental limitation"
681,V,TREE,tree(s),a conspicuous tree used as a landmark
682,V,TUND,tundra,"a marshy, treeless, high latitude plain, dominated by mosses, lichens, and low shrub vegetation under permafrost conditions"
683,V,VIN,vineyard,a planting of grapevines
684,V,VINS,vineyards,plantings of grapevines
